{
  "schemaVersion": 1,
  "asOf": "2026-08-11",
  "status": "internal_assessment_ready_external_gated",
  "purpose": "Prioritize Mythical's first commercial distribution candidates for evidence gathering without treating public research as qualification, demand, revenue, or outreach permission.",
  "authority": {
    "pipelineStageMutationAuthorized": false,
    "contactEnrichmentAuthorized": false,
    "recipientIdentificationAuthorized": false,
    "outreachDraftingAuthorized": false,
    "outreachSendingAuthorized": false,
    "accountCreationAuthorized": false,
    "termsAcceptanceAuthorized": false,
    "buildSharingAuthorized": false,
    "sdkIntegrationAuthorized": false,
    "pricingOrTermsAuthorized": false,
    "revenueForecastingAuthorized": false,
    "spendAuthorized": false,
    "contractingAuthorized": false,
    "externalActionAuthorized": false,
    "minorTargetingPermitted": false,
    "conversationIsAuthorization": false
  },
  "model": {
    "numericCompositeScorePermitted": false,
    "headlineReachCountsAsFit": false,
    "publicSourceCountsAsCustomerEvidence": false,
    "silenceCountsAsInterest": false,
    "internalRankMeaning": "Sequence for the next reversible evidence-gathering step only; not market attractiveness, revenue probability, or partner endorsement.",
    "dimensions": ["audienceFit", "productFit", "trustSafety", "strategicLearning", "reachQuality", "economicPotential", "controlRights", "integrationEffort", "operationalLoad", "reversibility"],
    "allowedRatings": ["positive", "mixed", "weak", "unknown"],
    "allowedEvidenceStates": ["source_supported", "internal_inference", "missing"],
    "qualificationRequires": ["Current official source review", "No triggered automatic disqualifier", "Named commercial owner", "Audience and product evidence", "Technical feasibility", "Privacy/safeguarding review", "Rights and terms review", "Operational support owner", "Financial decision boundary", "Kevin qualification decision"],
    "externalProgressionRequires": ["Qualified stage recorded", "Exact organization and purpose", "Public role-based recipient source", "Claims and authentic proof", "Approved sender/channel/message/window", "Contact and follow-up limits", "A-011 trusted approval evidence"]
  },
  "portfolioRecommendation": "Run one Game Development portal-build feasibility spike with OP-001 as the packaging baseline and OP-002 through OP-004 as requirement test cases; do not contact, create accounts, accept terms, integrate SDKs, upload builds, forecast revenue, or change pipeline stage.",
  "assessments": [
    {
      "opportunityRef": "OP-001",
      "organization": "itch.io",
      "sourceStage": "researched",
      "assessmentStatus": "researched_not_qualified",
      "recommendation": "technical_feasibility_first",
      "sequenceRank": 1,
      "valueHypothesis": "A low-coupling browser packaging and positioning test may provide useful distribution learning before SDK-heavy channels.",
      "decisionServed": "Can one portable browser build satisfy a simple hosted-page path without contaminating the canonical game?",
      "dimensions": {
        "audienceFit": { "rating": "mixed", "evidenceState": "internal_inference", "rationale": "General indie/browser discovery is plausible, but Mythical audience fit has no accepted customer evidence." },
        "productFit": { "rating": "mixed", "evidenceState": "source_supported", "rationale": "HTML browser packaging is supported, while current root-absolute paths and iframe behavior remain untested." },
        "trustSafety": { "rating": "mixed", "evidenceState": "internal_inference", "rationale": "Lower SDK coupling is attractive, but account, comments, moderation, terms, privacy, and age treatment remain unreviewed." },
        "strategicLearning": { "rating": "positive", "evidenceState": "internal_inference", "rationale": "The packaging spike can answer portability and listing-positioning questions reusable across later portals." },
        "reachQuality": { "rating": "unknown", "evidenceState": "missing", "rationale": "No Mythical-specific qualified reach or conversion evidence exists." },
        "economicPotential": { "rating": "unknown", "evidenceState": "missing", "rationale": "Donations, fees, tax, delivery cost, and willingness to support are unverified." },
        "controlRights": { "rating": "mixed", "evidenceState": "internal_inference", "rationale": "A simple listing appears reversible, but current terms and asset rights need professional review." },
        "integrationEffort": { "rating": "mixed", "evidenceState": "source_supported", "rationale": "Portable paths, ZIP layout, iframe, CSP/CORS, functions, and persistence need one bounded spike." },
        "operationalLoad": { "rating": "unknown", "evidenceState": "missing", "rationale": "Listing updates, support, comments, incident handling, and owner capacity are unassigned." },
        "reversibility": { "rating": "positive", "evidenceState": "internal_inference", "rationale": "A company-controlled isolated package can be withdrawn without making it the canonical build." }
      },
      "disqualifierReview": [
        { "id": "DQ-001", "state": "not_observed_in_public_research", "clearanceEvidenceRefs": [] },
        { "id": "DQ-002", "state": "requires_review", "clearanceEvidenceRefs": [] },
        { "id": "DQ-003", "state": "requires_review", "clearanceEvidenceRefs": [] },
        { "id": "DQ-004", "state": "not_observed_in_public_research", "clearanceEvidenceRefs": [] },
        { "id": "DQ-005", "state": "requires_review", "clearanceEvidenceRefs": [] },
        { "id": "DQ-006", "state": "requires_review", "clearanceEvidenceRefs": [] },
        { "id": "DQ-007", "state": "requires_review", "clearanceEvidenceRefs": [] },
        { "id": "DQ-008", "state": "not_observed_in_public_research", "clearanceEvidenceRefs": [] }
      ],
      "dependencyRefs": ["A-001", "A-007", "A-018", "A-021", "A-022", "A-026", "D-012", "D-014", "D-015", "D-016", "GDH-005", "R-001", "R-006", "R-007", "R-011", "R-012"],
      "internalNextAction": "Use OP-001 as the baseline case in GDH-005; produce technical evidence only and keep the opportunity at researched.",
      "financialAssumptions": { "currency": null, "revenueMinorUnits": null, "costMinorUnits": null, "probability": null, "timeWindow": null },
      "contact": null,
      "outreachPackage": null,
      "stageChangeAuthorized": false,
      "externalActionAuthorized": false
    },
    {
      "opportunityRef": "OP-004",
      "organization": "Newgrounds",
      "sourceStage": "researched",
      "assessmentStatus": "researched_not_qualified",
      "recommendation": "sequence_after_packaging_baseline",
      "sequenceRank": 2,
      "valueHypothesis": "An adult/general indie community pilot may provide qualitative feedback after portable packaging and moderation controls exist.",
      "decisionServed": "Can the portable package and adult-directed moderation model support useful community feedback without identity or social API integration?",
      "dimensions": {
        "audienceFit": { "rating": "mixed", "evidenceState": "internal_inference", "rationale": "Adult/general indie feedback may be useful, but audience and trust fit are unvalidated." },
        "productFit": { "rating": "mixed", "evidenceState": "source_supported", "rationale": "HTML ZIP and iframe support are relevant, while compatibility is untested." },
        "trustSafety": { "rating": "mixed", "evidenceState": "internal_inference", "rationale": "Community features create moderation and contact risks even with optional identity APIs disabled." },
        "strategicLearning": { "rating": "positive", "evidenceState": "internal_inference", "rationale": "A bounded community pilot could test comprehension and first-session response after adult research." },
        "reachQuality": { "rating": "unknown", "evidenceState": "missing", "rationale": "No qualified Mythical reach or response evidence exists." },
        "economicPotential": { "rating": "unknown", "evidenceState": "missing", "rationale": "Revenue, fees, support cost, and commercial outcomes are unverified." },
        "controlRights": { "rating": "mixed", "evidenceState": "internal_inference", "rationale": "Ownership rules appear relevant, but terms, rights, removal, and derivative treatment require review." },
        "integrationEffort": { "rating": "mixed", "evidenceState": "source_supported", "rationale": "Portable iframe packaging is needed; identity, save, scoreboard, and social APIs remain out of scope." },
        "operationalLoad": { "rating": "weak", "evidenceState": "internal_inference", "rationale": "Community monitoring, moderation, support, updates, and incident response have no named owner." },
        "reversibility": { "rating": "positive", "evidenceState": "internal_inference", "rationale": "An isolated no-social-API package could be removed if terms and export/removal controls are acceptable." }
      },
      "disqualifierReview": [
        { "id": "DQ-001", "state": "requires_review", "clearanceEvidenceRefs": [] },
        { "id": "DQ-002", "state": "requires_review", "clearanceEvidenceRefs": [] },
        { "id": "DQ-003", "state": "requires_review", "clearanceEvidenceRefs": [] },
        { "id": "DQ-004", "state": "not_observed_in_public_research", "clearanceEvidenceRefs": [] },
        { "id": "DQ-005", "state": "requires_review", "clearanceEvidenceRefs": [] },
        { "id": "DQ-006", "state": "requires_review", "clearanceEvidenceRefs": [] },
        { "id": "DQ-007", "state": "requires_review", "clearanceEvidenceRefs": [] },
        { "id": "DQ-008", "state": "not_observed_in_public_research", "clearanceEvidenceRefs": [] }
      ],
      "dependencyRefs": ["A-004", "A-007", "A-018", "A-020", "A-022", "A-026", "D-012", "D-014", "D-016", "GDH-005", "R-001", "R-006", "R-007", "R-009", "R-011", "R-012"],